res/vps-docker-single-task-00-500-full-vs-vps-docker-multi-task-00-500-10x50/tables/node_runtime_mean_duration_ms.csv

,vps-docker-single-task-00-500-full,vps-docker-multi-task-00-500-10x50
fs_async,143.51095807945683,201.68145888145182
fs_callback,163.73881415929202,158.56211209439527
promise_callback,2.7411929634151857,2.780817037707966
event_loop_immediate,1.5460178855325915,2.3660042016806724
event_loop_timers,4.423363636363636,3.562086956521739

notes.md

- `fs_async_mean_ms`
  - single: `143.511`
  - multi: `201.681`
- `fs_callback_mean_ms`
  - single: `163.739`
  - multi: `158.562`
- `promise_callback_mean_ms`
  - single: `2.741`
  - multi: `2.781`
- `event_loop_immediate_mean_ms`
  - single: `1.546`
  - multi: `2.366`